[
    {
        "fact_id": "fact_001",
        "encounter_id": "SYN_OUT_001",
        "fact_type": "symptom",
        "original_text": "Dạ em bị ho khoảng ba ngày nay.",
        "normalized_text": "ho",
        "assertion": "present",
        "speaker_role": "patient",
        "clinical_subject": {
            "subject_type": "patient",
            "relationship_to_patient": "self"
        },
        "source_segment_ids": [
            "seg_002"
        ],
        "doctor_confirmation_status": "pending",
        "coding_candidates": [
            {
                "system": "local_mvp_dictionary",
                "code": "SYM_COUGH",
                "display": "Ho"
            }
        ],
        "review_status": "pending_review",
        "confidence": 1.0,
        "created_at": "2026-06-02T00:00:00+07:00",
        "created_by": "Duy",
        "version": "v0.1.0",
        "source_evidence": [
            {
                "segment_id": "seg_002",
                "quote": "Dạ em bị ho khoảng ba ngày nay.",
                "start_time": 3.3,
                "end_time": 6.1
            }
        ]
    },
    {
        "fact_id": "fact_002",
        "encounter_id": "SYN_OUT_001",
        "fact_type": "symptom",
        "original_text": "Em ho khan là chính, thỉnh thoảng hơi rát họng.",
        "normalized_text": "ho khan",
        "assertion": "present",
        "speaker_role": "patient",
        "clinical_subject": {
            "subject_type": "patient",
            "relationship_to_patient": "self"
        },
        "source_segment_ids": [
            "seg_004"
        ],
        "doctor_confirmation_status": "pending",
        "coding_candidates": [
            {
                "system": "local_mvp_dictionary",
                "code": "SYM_DRY_COUGH",
                "display": "Ho khan"
            }
        ],
        "review_status": "pending_review",
        "confidence": 1.0,
        "created_at": "2026-06-02T00:00:00+07:00",
        "created_by": "Duy",
        "version": "v0.1.0",
        "source_evidence": [
            {
                "segment_id": "seg_004",
                "quote": "Em ho khan là chính, thỉnh thoảng hơi rát họng.",
                "start_time": 9.1,
                "end_time": 13.4
            }
        ]
    },
    {
        "fact_id": "fact_003",
        "encounter_id": "SYN_OUT_001",
        "fact_type": "symptom",
        "original_text": "Dạ có sốt nhẹ tối qua, khoảng ba mươi bảy độ tám.",
        "normalized_text": "sốt nhẹ",
        "assertion": "present",
        "speaker_role": "patient",
        "clinical_subject": {
            "subject_type": "patient",
            "relationship_to_patient": "self"
        },
        "source_segment_ids": [
            "seg_006"
        ],
        "doctor_confirmation_status": "pending",
        "coding_candidates": [
            {
                "system": "local_mvp_dictionary",
                "code": "SYM_FEVER",
                "display": "Sốt"
            }
        ],
        "review_status": "pending_review",
        "confidence": 1.0,
        "created_at": "2026-06-02T00:00:00+07:00",
        "created_by": "Duy",
        "version": "v0.1.0",
        "source_evidence": [
            {
                "segment_id": "seg_006",
                "quote": "Dạ có sốt nhẹ tối qua, khoảng ba mươi bảy độ tám.",
                "start_time": 15.1,
                "end_time": 19.2
            }
        ]
    },
    {
        "fact_id": "fact_004",
        "encounter_id": "SYN_OUT_001",
        "fact_type": "symptom",
        "original_text": "Dạ không, em không đau ngực và cũng không khó thở.",
        "normalized_text": "đau ngực",
        "assertion": "absent",
        "speaker_role": "patient",
        "clinical_subject": {
            "subject_type": "patient",
            "relationship_to_patient": "self"
        },
        "source_segment_ids": [
            "seg_008"
        ],
        "doctor_confirmation_status": "pending",
        "coding_candidates": [
            {
                "system": "local_mvp_dictionary",
                "code": "SYM_CHEST_PAIN",
                "display": "Đau ngực"
            }
        ],
        "review_status": "pending_review",
        "confidence": 1.0,
        "created_at": "2026-06-02T00:00:00+07:00",
        "created_by": "Duy",
        "version": "v0.1.0",
        "source_evidence": [
            {
                "segment_id": "seg_008",
                "quote": "Dạ không, em không đau ngực và cũng không khó thở.",
                "start_time": 22.8,
                "end_time": 27.1
            }
        ]
    },
    {
        "fact_id": "fact_005",
        "encounter_id": "SYN_OUT_001",
        "fact_type": "symptom",
        "original_text": "Dạ không, em không đau ngực và cũng không khó thở.",
        "normalized_text": "khó thở",
        "assertion": "absent",
        "speaker_role": "patient",
        "clinical_subject": {
            "subject_type": "patient",
            "relationship_to_patient": "self"
        },
        "source_segment_ids": [
            "seg_008"
        ],
        "doctor_confirmation_status": "pending",
        "coding_candidates": [
            {
                "system": "local_mvp_dictionary",
                "code": "SYM_DYSPNEA",
                "display": "Khó thở"
            }
        ],
        "review_status": "pending_review",
        "confidence": 1.0,
        "created_at": "2026-06-02T00:00:00+07:00",
        "created_by": "Duy",
        "version": "v0.1.0",
        "source_evidence": [
            {
                "segment_id": "seg_008",
                "quote": "Dạ không, em không đau ngực và cũng không khó thở.",
                "start_time": 22.8,
                "end_time": 27.1
            }
        ]
    },
    {
        "fact_id": "fact_006",
        "encounter_id": "SYN_OUT_001",
        "fact_type": "allergy",
        "original_text": "Dạ em chưa từng dị ứng thuốc.",
        "normalized_text": "dị ứng thuốc",
        "assertion": "absent",
        "speaker_role": "patient",
        "clinical_subject": {
            "subject_type": "patient",
            "relationship_to_patient": "self"
        },
        "source_segment_ids": [
            "seg_010"
        ],
        "doctor_confirmation_status": "pending",
        "coding_candidates": [
            {
                "system": "local_mvp_dictionary",
                "code": "ALL_DRUG_ALLERGY",
                "display": "Dị ứng thuốc"
            }
        ],
        "review_status": "pending_review",
        "confidence": 1.0,
        "created_at": "2026-06-02T00:00:00+07:00",
        "created_by": "Duy",
        "version": "v0.1.0",
        "source_evidence": [
            {
                "segment_id": "seg_010",
                "quote": "Dạ em chưa từng dị ứng thuốc.",
                "start_time": 30.2,
                "end_time": 32.9
            }
        ]
    },
    {
        "fact_id": "fact_007",
        "encounter_id": "SYN_OUT_001",
        "fact_type": "medication",
        "original_text": "Em có uống một viên paracetamol năm trăm miligam tối qua khi sốt.",
        "normalized_text": "paracetamol",
        "assertion": "present",
        "speaker_role": "patient",
        "clinical_subject": {
            "subject_type": "patient",
            "relationship_to_patient": "self"
        },
        "source_segment_ids": [
            "seg_012"
        ],
        "source_evidence": [
            {
                "segment_id": "seg_012",
                "quote": "Em có uống một viên paracetamol năm trăm miligam tối qua khi sốt.",
                "start_time": 35.4,
                "end_time": 40.5
            }
        ],
        "medication_details": {
            "drug_name": "paracetamol",
            "status": "taken_prior_to_visit",
            "dose_value": 500,
            "dose_unit": "mg",
            "dose_text": "năm trăm miligam",
            "quantity_value": 1,
            "quantity_unit": "viên",
            "quantity_text": "một viên",
            "route": "oral",
            "frequency": "once",
            "timing_text": "tối qua",
            "indication_text": "khi sốt"
        },
        "doctor_confirmation_status": "pending",
        "coding_candidates": [
            {
                "system": "local_mvp_dictionary",
                "code": "DRUG_PARACETAMOL",
                "display": "Paracetamol"
            }
        ],
        "review_status": "pending_review",
        "confidence": 1.0,
        "created_at": "2026-06-02T00:00:00+07:00",
        "created_by": "Duy",
        "version": "v0.1.0"
    },
    {
        "fact_id": "fact_008",
        "encounter_id": "SYN_OUT_001",
        "fact_type": "plan",
        "original_text": "Anh nghỉ ngơi, uống đủ nước, theo dõi nhiệt độ. Nếu sốt cao, khó thở hoặc đau ngực thì cần quay lại khám ngay.",
        "normalized_text": "nghỉ ngơi, uống đủ nước, theo dõi nhiệt độ, tái khám nếu có dấu hiệu nặng",
        "assertion": "recommended",
        "speaker_role": "doctor",
        "clinical_subject": {
            "subject_type": "patient",
            "relationship_to_patient": "self"
        },
        "source_segment_ids": [
            "seg_013"
        ],
        "doctor_confirmation_status": "pending",
        "coding_candidates": [],
        "review_status": "pending_review",
        "confidence": 1.0,
        "created_at": "2026-06-02T00:00:00+07:00",
        "created_by": "Duy",
        "version": "v0.1.0",
        "source_evidence": [
            {
                "segment_id": "seg_013",
                "quote": "Được rồi. Hiện tại triệu chứng của anh gợi ý viêm đường hô hấp trên mức độ nhẹ. Anh nghỉ ngơi, uống đủ nước, theo dõi nhiệt độ. Nếu sốt cao, khó thở hoặc đau ngực thì cần quay lại khám ngay.",
                "start_time": 40.6,
                "end_time": 52.5
            }
        ]
    }
]